{"schema_version":"1.0","id":"doc-1","document_type":"invoice","issue_date":"2026-05-26","document_number":"INV-1","currency":"EUR","supplier":{"name":"Sup","tax_ids":[],"address":{"lines":["L"],"city":"C","postal_code":"00000","country":"DE"}},"customer":{"name":"Cust","tax_ids":[],"address":{"lines":["L"],"city":"C","postal_code":"00000","country":"FR"}},"payment_instructions":[],"lines":[{"id":"1","description":"d","quantity":"1","unit_price":"100.00","line_extension_amount":"100.00","extensions":[]}],"tax_summary":[],"monetary_total":{"line_extension_amount":"100.00","tax_exclusive_amount":"100.00","tax_inclusive_amount":"100.00","payable_amount":"100.00"},"extensions":[],"meta":{"tenant_id":"t","trace_id":"x"}}
